{
  "type": "aos.employer_brand_element_clip_acceptance_report",
  "schema_version": "2026-05-employer-brand-element-clip-acceptance-report-v0",
  "id": "element-clip-acceptance-report:element-clip-manifest:element-capture-planning-bundle:source-artifact-target-plan:kilos-comp-audit-source-elements-v0",
  "label": "Employer Brand Element Clip Acceptance Verification V0",
  "status": "accepted_with_blockers",
  "inputs": {
    "planning_bundle_path": "source-artifacts/element-capture-planning-bundle.json",
    "planning_bundle_schema": "shared/schemas/employer-brand-element-capture-planning-bundle-v0.schema.json",
    "clip_manifest_path": "source-artifacts/element-clip-manifest.json",
    "clip_manifest_schema": "shared/schemas/employer-brand-element-clip-manifest-v0.schema.json",
    "planned_clip_manifest_path": "source-artifacts/element-clip-manifest.planned.json",
    "comparative_audit_data_bundle_path": "data-bundle.json",
    "comparative_audit_data_bundle_id": "employer-brand-comparative-audit-data-bundle:symphony-talent-phenom-radancy"
  },
  "summary": {
    "target_count": 13,
    "work_unit_count": 37,
    "expected_clip_count": 44,
    "captured_count": 16,
    "blocked_count": 21,
    "failed_count": 0,
    "not_run_count": 0,
    "total_result_count": 37,
    "accepted": true,
    "manifest_count_checks_passed": true
  },
  "controls": {
    "read_only": true,
    "verifier_only": true,
    "capture_execution_authorized": false,
    "live_browser_collection_authorized": false,
    "remote_web_collection_authorized": false,
    "pdf_capture_execution_authorized": false,
    "pptx_capture_execution_authorized": false,
    "report_renderer_authorized": false,
    "export_execution_authorized": false,
    "workflow_engine_authorized": false,
    "full_page_grabs_authorized": false
  },
  "non_goal_flags": [
    "new_captures",
    "live_browser_collection",
    "remote_web_collection",
    "pdf_capture_execution",
    "pptx_capture_execution",
    "report_renderer",
    "html_css_polish",
    "pdf_export",
    "docx_export",
    "workflow_engine",
    "full_page_grabs"
  ],
  "manifest_count_checks": [
    {
      "name": "work_unit_count_reconciled",
      "status": "pass",
      "message": null,
      "evidence": {
        "expected": 37,
        "actual": 37
      }
    },
    {
      "name": "captured_count_reconciled",
      "status": "pass",
      "message": null,
      "evidence": {
        "manifest_clip_count": 16,
        "manifest_expected_captured_count": 16,
        "verifier_captured_count": 16
      }
    },
    {
      "name": "blocked_count_reconciled",
      "status": "pass",
      "message": null,
      "evidence": {
        "manifest_expected_blocked_count": 21,
        "verifier_blocked_count": 21,
        "manifest_not_run_slots": 21
      }
    },
    {
      "name": "planned_manifest_slot_count_preserved",
      "status": "pass",
      "message": null,
      "evidence": {
        "planned_manifest_slot_count": 37,
        "populated_manifest_slot_count": 37
      }
    }
  ],
  "results": [
    {
      "work_unit_id": "work-unit:pdf-method-scope-bullets",
      "target_id": "target:pdf-method-scope-bullets",
      "source_artifact_id": "source:kilos-template-pdf",
      "source_artifact_kind": "pdf",
      "company_ref_id": null,
      "capture_type": "element_clip_and_text_extract",
      "readiness_state": "blocked_unresolved_pdf_crop",
      "status": "blocked",
      "clip_path": null,
      "text_extract_path": null,
      "blockers": [
        "pdf_crop_coordinates_unresolved",
        "pdf_text_region_parser_needed"
      ],
      "kilos_relevance": [
        "kinship",
        "impact",
        "lifestyle",
        "opportunity",
        "status"
      ],
      "acceptance_criteria": [
        "The clip includes all bullets for messaging, tone, campaigns, job listings, social channels, reviews, and awards.",
        "The clip excludes the full slide frame and does not include unrelated deck chrome.",
        "The text extract preserves the scope list as separate bullet-like entries."
      ],
      "checks": [
        {
          "name": "target_work_unit_linkage",
          "status": "pass",
          "message": null,
          "evidence": {
            "target_id": "target:pdf-method-scope-bullets",
            "work_unit_id": "work-unit:pdf-method-scope-bullets"
          }
        },
        {
          "name": "blocked_slot_preserved",
          "status": "pass",
          "message": null,
          "evidence": {
            "work_unit_id": "work-unit:pdf-method-scope-bullets"
          }
        },
        {
          "name": "blocked_slot_status",
          "status": "pass",
          "message": null,
          "evidence": {
            "status": "not_run"
          }
        },
        {
          "name": "blocked_slot_has_no_clip_asset",
          "status": "pass",
          "message": null,
          "evidence": {
            "clip_path": null,
            "text_extract_path": null
          }
        },
        {
          "name": "blocked_slot_kilos_preserved",
          "status": "pass",
          "message": null,
          "evidence": {
            "expected": [
              "kinship",
              "impact",
              "lifestyle",
              "opportunity",
              "status"
            ],
            "actual": [
              "kinship",
              "impact",
              "lifestyle",
              "opportunity",
              "status"
            ]
          }
        },
        {
          "name": "blocked_slot_acceptance_criteria_preserved",
          "status": "pass",
          "message": null,
          "evidence": {
            "expected_count": 3,
            "actual_count": 3
          }
        }
      ]
    },
    {
      "work_unit_id": "work-unit:pdf-summary-insight-blocks",
      "target_id": "target:pdf-summary-insight-blocks",
      "source_artifact_id": "source:kilos-template-pdf",
      "source_artifact_kind": "pdf",
      "company_ref_id": null,
      "capture_type": "element_clip_and_text_extract",
      "readiness_state": "blocked_unresolved_pdf_crop",
      "status": "blocked",
      "clip_path": null,
      "text_extract_path": null,
      "blockers": [
        "pdf_crop_coordinates_unresolved",
        "pdf_text_region_parser_needed"
      ],
      "kilos_relevance": [
        "kinship",
        "impact",
        "lifestyle",
        "opportunity",
        "status"
      ],
      "acceptance_criteria": [
        "Exactly four clips are produced, one per labeled block.",
        "Each clip includes its label and body text.",
        "No clip includes the entire slide or another labeled block."
      ],
      "checks": [
        {
          "name": "target_work_unit_linkage",
          "status": "pass",
          "message": null,
          "evidence": {
            "target_id": "target:pdf-summary-insight-blocks",
            "work_unit_id": "work-unit:pdf-summary-insight-blocks"
          }
        },
        {
          "name": "blocked_slot_preserved",
          "status": "pass",
          "message": null,
          "evidence": {
            "work_unit_id": "work-unit:pdf-summary-insight-blocks"
          }
        },
        {
          "name": "blocked_slot_status",
          "status": "pass",
          "message": null,
          "evidence": {
            "status": "not_run"
          }
        },
        {
          "name": "blocked_slot_has_no_clip_asset",
          "status": "pass",
          "message": null,
          "evidence": {
            "clip_path": null,
            "text_extract_path": null
          }
        },
        {
          "name": "blocked_slot_kilos_preserved",
          "status": "pass",
          "message": null,
          "evidence": {
            "expected": [
              "kinship",
              "impact",
              "lifestyle",
              "opportunity",
              "status"
            ],
            "actual": [
              "kinship",
              "impact",
              "lifestyle",
              "opportunity",
              "status"
            ]
          }
        },
        {
          "name": "blocked_slot_acceptance_criteria_preserved",
          "status": "pass",
          "message": null,
          "evidence": {
            "expected_count": 3,
            "actual_count": 3
          }
        }
      ]
    },
    {
      "work_unit_id": "work-unit:pdf-messaging-snapshot-table",
      "target_id": "target:pdf-messaging-snapshot-table",
      "source_artifact_id": "source:kilos-template-pdf",
      "source_artifact_kind": "pdf",
      "company_ref_id": null,
      "capture_type": "element_clip_and_text_extract",
      "readiness_state": "blocked_unresolved_pdf_crop",
      "status": "blocked",
      "clip_path": null,
      "text_extract_path": null,
      "blockers": [
        "pdf_crop_coordinates_unresolved",
        "pdf_text_region_parser_needed"
      ],
      "kilos_relevance": [
        "kinship",
        "impact",
        "lifestyle",
        "opportunity",
        "status"
      ],
      "acceptance_criteria": [
        "The clip includes the table headers and all visible company rows on the page.",
        "The clip preserves headline-to-company alignment.",
        "The clip does not include adjacent page number or unrelated margins."
      ],
      "checks": [
        {
          "name": "target_work_unit_linkage",
          "status": "pass",
          "message": null,
          "evidence": {
            "target_id": "target:pdf-messaging-snapshot-table",
            "work_unit_id": "work-unit:pdf-messaging-snapshot-table"
          }
        },
        {
          "name": "blocked_slot_preserved",
          "status": "pass",
          "message": null,
          "evidence": {
            "work_unit_id": "work-unit:pdf-messaging-snapshot-table"
          }
        },
        {
          "name": "blocked_slot_status",
          "status": "pass",